{"$schema":"https://json-schema.org/draft/2020-12/schema","$id":"https://boxi-chinese.github.io/chinese-explain/schemas/lesson-bundle-v0.1.json","title":"Boxi Chinese lesson bundle v0.1","type":"object","required":["schema_version","lesson_id","title","learner_level","context","segments","task","feedback_dimensions","revision_prompt","transfer_prompt"],"properties":{"schema_version":{"const":"lesson-bundle/v0.1"},"lesson_id":{"type":"string"},"title":{"type":"string"},"learner_level":{"type":"string"},"context":{"type":"string"},"segments":{"type":"array"},"task":{"type":"string"},"feedback_dimensions":{"type":"array"},"revision_prompt":{"type":"string"},"transfer_prompt":{"type":"string"}},"additionalProperties":false}