{"schema_version":"lesson-bundle/v0.1","lesson_id":"tones-context","title":"四声在语境中改变意义","learner_level":"beginner","context":"在点餐时，学习者需要听辨一个目标词的声调。","segments":[{"id":"target","text":"买米","pinyin":"mǎi mǐ","translation":"buy rice"},{"id":"contrast","text":"卖米","pinyin":"mài mǐ","translation":"sell rice"}],"task":"Choose the phrase that means buy rice, then say a new sentence with 买.","feedback_dimensions":["tone","character","communicative_fit"],"revision_prompt":"Repeat the target phrase and keep the third tone on 买.","transfer_prompt":"Use 买 in a new sentence about a market."}