{"schema_version":"lesson-bundle/v0.1","lesson_id":"word-order-context","title":"时间短语和动作顺序","learner_level":"intermediate","context":"说话者说明昨天先完成什么，再出门。","segments":[{"id":"target","text":"昨天我先吃饭，然后去上课。","pinyin":"Zuótiān wǒ xiān chīfàn, ránhòu qù shàngkè.","translation":"Yesterday I ate first, then went to class."}],"task":"Put the time phrase and two actions in a natural order.","feedback_dimensions":["word_order","aspect_or_sequence","communicative_fit"],"revision_prompt":"Make the sequence between the two actions explicit.","transfer_prompt":"Describe two things you did this morning in order."}